6/22/2018 11:36,Hypothesis,36,"Increases in incidence can also result from changes in socioeconomic and human activities, such as expansion into risky new habitats for exploitation or dwelling, or land-cover change, such as reforestation of previously agricultural areas. Human infection with VBPs increases with the product of entomological risk (the abundance of infected vectors) and exposure of people to vectors, which can change independently and sometimes synergistically.",,,,(changes in) interspecies contact,,,(changes in) abundance and distribution,vector transmission,"encroachment, reforestation and restoration",
6/22/2018 11:49,Hypothesis,36,"Exposure to ticks, paradoxically, might be higher in people of high and low income than in those with intermediate income...Generally, outdoor recreational opportunities associated with wealth can result in increased exposure to vectors. Conversely, hardship precipitated by population displacements due to civil conflict, loss of protective housing through natural disasters, or use of natural environmental resources driven by economic transitions can lead to increased contact between people and vectors.",,extreme climate events,,(changes in) interspecies contact,,"human displacement, poverty, war & conflict",,vector transmission,,
6/22/2018 11:56,Hypothesis,36,increased transmission of VBPs with warming along the cold latitudinal and altitudinal edges of their present distribution...Expansions in the distribution of a disease might have disproportionate effects on public health if the newly exposed populations have little immunity.,,global warming,(changes in) susceptibility,,,,,vector transmission,,
6/22/2018 12:00,Hypothesis,36,"One underappreciated aspect of growing human populations, global land-use change, and the introduction of human commensal vectors is the selective pressure exerted on pathogens, causing them to evolve to take advantage of new environments, including hosts and vectors.",,,(changes in) human density and distribution,,,,,"adaptation and evolution, vector transmission",land use (general),
6/22/2018 12:05,Hypothesis,36,"More generally, the transmission of many VBPs is less efficient when the vector feeds on several hosts, only some of which can be infected by the pathogen.",,,,(changes in) community composition,,,reservoir competence,vector transmission,,
6/22/2018 12:07,Hypothesis,36,climate change will lead to more widespread and more abundant VBPs as more of the planet starts to closely resemble the tropics where VBPs are presently most abundant,,climate change (non-specific),,,,,,vector transmission,,
6/22/2018 12:10,Hypothesis,36,"Specifically, higher temperatures increase three aspects of transmission for vector-borne pathogens: vector biting rate, vector development rate, and pathogen replication (thereby reducing the extrinsic incubation period or the time between a vector feeding on an infected host and being able to transmit the pathogen). However, they frequently decrease a fourth, vector survival, especially when associated with moisture stress. As a result, increased temperatures might lead to increases or decreases in transmission depending on the relative effects of these factors.",,"climate change (non-specific), (changes in) humidity, (changes in) temperature",,,,,,vector transmission,,
6/22/2018 14:13,Hypothesis,37,"Changing geographic distributions generate new footprints for hosts and their parasites and sometimes generate new sympatries for individuals and species. As a result, parasites might switch between established and newly arrived hosts and/or host species, and first-time exposure of hosts in the absence of specific immunity might result in deleterious health impacts. In addition, immigration or emigration of hosts and/or host species not susceptible to a parasite can influence parasite transmission.",,,(changes in) susceptibility,(changes in) geographic overlap,,,(changes in) abundance and distribution,host switching and breadth (generalism/specialism),,
6/22/2018 14:23,Hypothesis,37,"Ecosystem change brought about by the new climate is leading to new associations involving hosts, parasites and other biotic components of the ecosystem. Examples include new assemblages of host species, parasite species, parasites and other pathogens, as well as new associations resulting from altered host and parasite behavior, and altered ecological networks. For parasite zoonoses in people, the key associations are those that lead to human infection.",,climate change (non-specific),,(changes in) community composition,,,,,,
6/22/2018 14:27,Hypothesis,37,"There is considerable evidence that climate change has, and will increasingly have, a direct influence on the distribution of vectors of parasitic diseases (particularly arthropods), either directly or indirectly, by impacting on the distribution and availability of hosts and, thus, parasite transmission, leading to changes in both the distribution and the incidence of disease",,climate change (non-specific),,,,,(changes in) abundance and distribution,vector transmission,,
6/22/2018 15:37,Hypothesis,38,The close relationship between pathogens and their tick vectors makes the pathogens susceptible to the abiotic factors affecting ticks...Bioclimatic threshold temperatures affect the transmission of TBDs,,(changes in) temperature,,,,,,vector transmission,,
6/22/2018 15:39,Hypothesis,38,"Ticks find their hosts either passively by questing on vegetation, waiting in a host’s nest or burrow or actively by moving toward more distant stimuli. Micro- and macroclimatic factors influence this behavior and are therefore likely to decrease or increase the human risk of becoming infected with a TBP.",,climate change (non-specific),,,,,(changes in) life history,vector transmission,,
6/22/2018 16:44,Hypothesis,38,"Disease risk is reduced by the presence of hosts with a low capacity to infect feeding vectors (incompetent reservoirs) which dilute the effect of competent reservoir hosts...In nature, this dilution effect is most likely supported by an increased biodiversity...increasing species richness, but not evenness, leads to a reduced disease risk, since dilution effects are most pronounced when alternative hosts have negative influences (e.g. predation or competition) on dominant reservoir hosts within the community.",,,,"(changes in) biodiversity, (changes in) community composition",,,reservoir competence,vector transmission,,
6/22/2018 16:44,Hypothesis,38,"The dilution effect theory has, however, been challenged by different studies which show that the loss of biodiversity in some communities led to a decrease in disease risk. This happens when pathogen transmission is greater within species than between species, particularly when a suitable host species is dominant, highly abundant and widespread",,,,(changes in) biodiversity,,,,,,
6/24/2018 16:45,Hypothesis,38,"Populations of urban-adapted hosts can reach densities in urban and suburban areas that are much higher than observed in undisturbed areas. Moreover, an abundance of certain resources is available in the city areas throughout the year via human waste or intentional feeding by citizens. These can additionally support thriving urban-adapted animal populations and can lead to increased contact with humans.",,,,(changes in) interspecies contact,,,"(changes in) abundance and distribution, (changes in) foraging behaviour",,urbanization,
6/24/2018 16:49,Hypothesis,38,"In the developed world, urbanization is typically implemented in a structured way, often with green areas, whereas in developing countries the expansion of urban areas happens much faster, is less structured and can lead to poor infrastructure, poor housing, high human density, impoverished suburbs and highly polluted city centres. Both types of expansion can create conditions suitable for tick and host existence and thus lead to the emergence of TBDs",,,(changes in) human density and distribution,,,"poverty, (changes in) sanitation and public health infrastructure",,vector transmission,"environmental degradation, urbanization",
6/24/2018 16:55,Hypothesis,38,"It is not only the landscape but also the mean temperature in urban environments that differs from the surrounding areas, being between 1 and 6.5 C higher on warm days. This heat island effect is presumably caused by heat absorption from dark surfaces in built-up areas and its subsequent re-radiation as thermal infrared radiation, together with the lack of vegetation. This temperature pattern might influence the survival, activity and distribution of ticks in cities, with a possible impact on reproductive success, the period of tick activity both from a daily and an annual perspective, and thus have an effect on pathogen prevalences.",,(changes in) temperature,,,,,(changes in) abundance and distribution,vector transmission,urbanization,
6/24/2018 16:56,Hypothesis,38,"The contamination of tick habitats by increased environmental pollution with heavy metals from industry and cars can lead to exoskeleton abnormalities in ticks. Ticks bearing such cuticular anomalies are more susceptible to infection with a variety of TBPs, including a higher prevalence of multi-infection, while also showing behavioural changes, such as enhanced activity, that increase the risk of human infection",,,,,,,,vector transmission,"environmental degradation, urbanization",
6/24/2018 17:02,Hypothesis,38,"As cities expand, human populations encroach upon their rural, peri-urban and suburban surroundings, invading natural and seminatural environments such as forests and former agricultural land. This urban sprawl can lead to an increased exposition of humans to vector ticks and TBPs due to the general increase of contact zones between wildlife and humans or domestic animals. Even though urbanization decreases the abundance and diversity of wildlife parasites, pathogen transmission can increase among urban-adapted hosts, resulting in the emergence of urban zoonotic disease cycles and the spread of infectious agents such as TBPs in urbanized areas",,,,(changes in) interspecies contact,,,,vector transmission,"encroachment, urbanization",
6/24/2018 17:06,Hypothesis,38,"Today reforestation, together with habitat fragmentation, may lead to an increase in tick-suitable habitats and thus potentially to a rise in pathogen prevalence...The re-colonization of abandoned land and reforestation to ensure sustainability of forests are also considered as key factors in the emergence of TBDs via the creation of suitable tick habitats...Reforestation, however, is likely to open up new areas with a suitable microclimate and host populations allowing the establishment of ticks and the epidemiological cycle of TBDs",,,,,,,(changes in) abundance and distribution,vector transmission,"fragmentation, reforestation and restoration",
6/24/2018 17:11,Hypothesis,38,"Animal husbandry is assumed to have been a source of human exposure to zoonoses since ancient times. Among the large variety of vertebrates that can act as amplification hosts for different zoonotic TBDs, pets and livestock represent some of the largest reservoirs for human infection. In developing countries, densely populated urban and peri-urban slums are a common side effect of urbanization which often harbour high densities of domestic animals such as poultry, pigs or small ruminants. These are bred in small-scale private farms and serve, amongst others things, as a source of food, income and security. They live in close contact with humans. This scenario with plenty of hosts, especially for adult ticks, provides excellent conditions for tick existence, and the close contact to humans can result in the emergence of TBDs.","(changes in) agriculture and farming practices, (changes in) livestock densities and distribution",,,"(changes in) community composition, (changes in) interspecies contact",,"poverty, (changes in) sanitation and public health infrastructure","bird, swine",,urbanization,
6/25/2018 13:45,Hypothesis,38,"Employment is one way in which humans are confronted with tick-infested habitats, often on a regular and/or frequent basis. Rangers, hunters or lumberjacks, for whom the forest is the designated place of work, are among the highest-risk occupations for contracting TBDs...Besides encountering tick-infested habitats on a professional basis, domestic activities such as walking the dog or collecting firewood in tick habitat are regarded as sources of increased exposure to ticks in their natural habitat...Leisure activities such as fishing, jogging or hiking that typically take place in natural tick habitats have also been identified as risk factors for infection",,,(changes in) hunting behaviour,"(changes in) geographic overlap, (changes in) interspecies contact",,,,,encroachment,
6/25/2018 13:50,Hypothesis,38,"An increase in temperature in certain areas, leading to a hotter and drier climate, might limit the population density of ticks and thus the risk of TBPs",,"global warming, (changes in) temperature",,,,,(changes in) abundance and distribution,vector transmission,,
6/25/2018 13:59,Hypothesis,38,It seems rather that the anthropogenic related movement of host animals over long distances leads to the introduction of ticks to new areas. The massive translocation of livestock has already led to the introduction and geographical spread of ticks and their associated pathogens into new areas.,(changes in) livestock densities and distribution,,,,,,,vector transmission,,
6/25/2018 14:00,Hypothesis,38,"Another aspect of increasing mobility is travel health. International travellers represent a group potentially at high risk of disease acquisition wherever they enter endemic areas, because they tend to have limited knowledge about health risks in the destination area and are easily exposed to tick-infested habitats",,,,,tourism and travel,,,vector transmission,,
6/25/2018 15:48,Hypothesis,39,"The effects of climate change on the epidemiology of mosquito-borne viral diseases are not easily predictable. Although cursory consideration might conclude that increases in temperature and rainfall will produce increased incidence of arboviral diseases, in fact the ecologic determinants of these diseases interact in complex ways...Extremely high temperatures can increase mosquito mortality, which could decrease arboviral disease transmission. Heavy rainfall can wash out mosquito breeding sites. Humans may seek refuge in air-conditioned buildings during heatwaves that might otherwise expose them to mosquito bites...Increasing temperatures can increase the transmission of arboviruses by decreasing the development time of mosquito vectors..., by decreasing the extrinsic incubation period, and by increasing the viral titer in mosquitoes",,"(changes in) precipitation, (changes in) temperature",(changes in) human density and distribution,,,,,"virus, vector transmission",,
6/25/2018 15:54,Hypothesis,39,"For both mosquito–human–mosquito transmission and bird–mosquito–human transmission, changes in human behavior, such as water storage, land use and irrigation, patterns of dwelling construction, use of air-conditioning, and intensity of mosquito control efforts all can interact with climate to alter the incidence of human disease.",(changes in) water management,,,,,,bird,"virus, vector transmission","land use (general), urbanization",
6/25/2018 15:57,Hypothesis,39,"Ticks are restricted to geographic locations where climatic conditions are suitable for completion of their life cycles and changing climatic conditions (i.e., temperature and precipitation) may shift the geographic range and seasonal period of disease risk and alter transmission dynamics within endemic areas, thereby resulting in changes in spatial and temporal patterns of human disease...Time of onset of human illness and frequency of infection are both associated with seasonal changes in the abundance of host-seeking vector ticks. Because host-seeking phenology is strongly affected by temperature and precipitation, it is likely that climate change will alter the timing and duration of peak risk of exposure to tickborne pathogens.",,"(changes in) precipitation, (changes in) temperature",,,,,(changes in) abundance and distribution,vector transmission,,
6/25/2018 16:40,Hypothesis,40,"It has also been suggested that wildlife host species richness is an important predictor of disease emergence. Conversely, however, biodiversity has also been linked to a decrease in disease risk through the ‘dilution effect’. This was first developed as a framework to infer the dynamics of tick-borne Lyme disease, and describes the association between increasing species richness and reduced disease risk, particularly when the most competent hosts were dominant in the community and alternative hosts negatively influenced the dominant hosts as reservoirs",,,,(changes in) biodiversity,,,,,,
6/25/2018 16:44,Hypothesis,40,"as the host population increases in size, the probability that a virus will be sampled increases, although it is likely that additional factors, including prior immunity and population age structure, will also impact the probability of virus sampling.",,,"(changes in) human density and distribution, (changes in) susceptibility",,,,,virus,,
6/26/2018 13:00,Hypothesis,41,"Contact between donor and recipient hosts is a precondition for virus transfer and is therefore affected by the geographical, ecological, and behavioral separation of the donor and recipient hosts. Factors that affect the geographical distribution of host species (e.g., wildlife trade and the introduction of domestic species) or that decrease their behavioral separation (e.g., bush meat hunting) tend to promote viral emergence",,,(changes in) hunting behaviour,(changes in) geographic overlap,(changes in) animal trade and transport,,,,,
6/26/2018 15:32,Hypothesis,41,"Spillover or epidemic infections have occurred between hosts that are closely or distantly related, and no rule appears to predict the susceptibility of a new host...Viral host switches between closely related species (e.g., between species within genera) may also be limited by cross-immunity to related pathogens or by innate immune resistance to related viral groups.",,,,,,,phylogenetic relatedness,"virus, host switching and breadth (generalism/specialism), immune evasion",,
6/26/2018 15:37,Hypothesis,41,"The initial viral interaction with cells of a new host is a critical step in determining host specificity, and changes in receptor binding often play a role in host transfer...Gaining the ability to bind the new receptor effectively may be a complex process and require multiple changes in the virus.",,,,,,,,"virus, adaptation and evolution, host switching and breadth (generalism/specialism)",,
6/26/2018 15:40,Hypothesis,41,"Since the initial infection of individuals of the alternative host is a key step in viral emergence, the preexisting host range of a virus has been thought to influence its ability to become established in a new host. “Generalist” viruses, which infect many different hosts, might be expected to show an increased likelihood of shifting to additional hosts, as they can already use the host cell mechanisms of many hosts to infect and replicate. In contrast, specialist viruses, which naturally infect only one or a few closely related hosts, appear likely to be more strongly restricted by the different receptors and replication mechanisms in newly encountered hosts. However, both generalist and specialist viruses are known to have become established successfully in new hosts, suggesting that there is no generalization that can be made about the likelihood of either type of virus infecting a previously resistant host to create a new epidemic pathogen",,,,,,,,"virus, host switching and breadth (generalism/specialism)",,
6/26/2018 15:43,Hypothesis,41,"in other cases emergence requires the evolution of the virus to allow efficient infection and transmission within the new host. The evolution of viruses to allow adaptation to new hosts is still not well understood. The level of genetic variation is important, and most viruses transferred to new hosts are poorly adapted, replicate poorly, and are inefficiently transmitted, so that the greater the rate of variation the more likely a virus is to adapt to the new host. This indicates that cross-species transmission should be more common in rapidly evolving viruses",,,,,,,,"virus, adaptation and evolution, host switching and breadth (generalism/specialism)",,
6/26/2018 17:05,Hypothesis,42,"During unfavorable weather periods, nidus dimensions often contract to spatially delimited refugia that enable host and/or vector and pathogen persistence. Under permissive temperatures, moisture-related focus contraction actually may enhance host-vector contact and therefore transmission.",,"(changes in) precipitation, (changes in) temperature",,(changes in) geographic overlap,,,,vector transmission,,
6/26/2018 17:09,Hypothesis,42,"Pathogen transmission seems to progress most effectively under warm temperatures, because vector populations increase rapidly in abundance and generation times are shortened; blood feeding and oviposition occur more frequently, increasing the frequency of host-vector contact; and rapid pathogen development within the vector shortens the duration of the extrinsic incubation period, thereby increasing the efficiency of transmission. Collectively, changes in these temperature-sensitive variables increase vectorial capacity or the force of transmission that, in part, determines the shape of amplification and epidemic curves and establishes the receptivity of new areas for pathogen invasion.",,(changes in) temperature,,(changes in) interspecies contact,,,"(changes in) abundance and distribution, (changes in) life history",vector transmission,,
6/26/2018 17:12,Hypothesis,42,"Areas with high soil wetness and primary productivity during summer delineate areas suitable for mosquito production and for plants and insects, potential food items for bird populations. Areas with increased vector mosquito and avian abundance potentially have increased transmission of arboviruses such as WNV. On a fine scale, ecotones frequently are utilized by upland bird species such as mourning doves and house finches for roosting and nesting and by mosquitoes for flight paths and host seeking...ecotones seem to define areas of high risk for human infection.",,(changes in) precipitation,,(changes in) geographic overlap,,,"bird, (changes in) abundance and distribution",vector transmission,,
6/26/2018 17:18,Hypothesis,42,"Vectors such as mosquitoes typically have short life cycles, rapid gonotrophic cycles, multiple blood meals during adult life, and therefore frequent, but intermittent, host contact.",,,,(changes in) interspecies contact,,,(changes in) life history,vector transmission,,
6/26/2018 17:22,Hypothesis,42,"Anthropogenic influences such as expanding agriculture or urbanization can markedly change historic nidus dynamics by altering patch size and expanding ecotonal areas, thereby juxtaposing reservoir hosts, domestic animals, and human hosts to vector populations and enhancing tangential transmission...In vast monocultural agricultural settings, farmsteads effectively function as epidemiological islands, bringing nesting/roosting avian hosts and nocturnally questing mosquitoes together in time and space...This concept also applies to small communities within agroecosystems or to parkland or wetlands within or adjacent to urban continuums",(changes in) agriculture and farming practices,,,(changes in) geographic overlap,,,bird,vector transmission,"land conversion for agriculture, urbanization",
6/26/2018 17:24,Hypothesis,42,"Long-distance movements of mosquitoes and arboviruses have been associated with storm fronts and prevailing wind patterns, resulting in the intercontinental dispersal of both vectors and pathogens",,extreme climate events,,,,,(changes in) abundance and distribution,vector transmission,,
6/26/2018 17:26,Hypothesis,42,"For zoonoses, the increase in ecotonal areas has been associated with residences and associated landscaping becoming interspersed among climax and subclimax vegetation or within agroecosystems, especially monocultures such as rice. As indicated above, these fragmented landscapes bring reservoir hosts, vectors, and humans together, enhancing amplification and the risk for tangential transmission.",,,,"(changes in) geographic overlap, (changes in) interspecies contact",,,,vector transmission,"encroachment, fragmentation, land conversion for agriculture, urbanization",
6/28/2018 15:44,Hypothesis,43,"climatic changes may drive the emergence and re-emergence of vector-borne diseases in several ways: (i) poleward spread of vectors and vector-borne pathogens as climate warms in temperate zones and becomes more suitable for these species. This process may also be accompanied by poleward contraction of the most equatorial limits of these species if temperatures become too hot for them; (ii) greater likelihood and frequency of introduction and endemic establishment of tropical and subtropical vector-borne diseases into currently temperate regions by a combination of (a) rising temperatures in the receiving location, increasing vector and vector-borne pathogen survival; (b) increasing abundance of vectors and vector-borne pathogens in tropical and subtropical source locations; and (c) increasing rates of import of (particularly) tropical and subtropical vector-borne pathogens due to increased climate change-related human migration",,"global warming, (changes in) temperature",(changes in) human density and distribution,(changes in) geographic overlap,,,(changes in) abundance and distribution,vector transmission,,
