6/17/2018 21:43,Hypothesis,12,"Microbes, like all other living things, are constantly evolving. The emergence of antibiotic-resistant bacteria as a result of the ubiquity of antimicrobials in the environment is an evolutionary lesson on microbial adaptation, as well as a demonstration of the power of natural selection. Selection for antibiotic-resistant bacteria and drug-resistant parasites has become frequent, driven by the wide and sometimes inappropriate use of antimicrobial drugs in a variety of applications. Pathogens can also acquire new antibiotic resistance genes from other, often non-pathogenic, species in the environment, selected for or perhaps even driven by the selective pressure of antibiotics.",,,,,,,,"adaptation and evolution, drug resistance",,
6/17/2018 21:44,Hypothesis,12,Many viruses show a high mutation rate and can rapidly evolve to yield new variants.,,,,,,,,"virus, adaptation and evolution",,
6/17/2018 21:47,Hypothesis,12,"Re-emerging diseases are diseases which were once decreasing, but are now rapidly increasing again. Classical public health and sanitation measures have long served to minimise dissemination and human exposure to many pathogens which are spread by traditional routes (such as water or food), or are preventable by immunisation or vector control. However, the pathogens themselves often till remain, in small pockets of infection, and may therefore re-emerge if circumstances allow. Often these circumstances are breakdowns in disease prevention and control measures. Thus, re-emerging infectious diseases are often conventionally understood and well-recognised public health threats for which (in most cases) previously active public health or control measures have been allowed to lapse. This is a situation that unfortunately now applies all too often, in both developing countries and the inner cities of the industrialised world. The appearance of re-emerging diseases may often be a sign of the breakdown of public health measures. It should also be a warning against complacency when considering infectious diseases.",,,,,,"(changes in) governance & politics, poverty, (changes in) sanitation and public health infrastructure",,"non-close contact, vector transmission",,
6/6/2018 13:37,Hypothesis,13,"Encroachment of human settlements and agriculture on natural ecosystems results in expansion of ecotones (transition zones between adjacent ecological systems), where species assemblages from different habitats mix. This provides new opportunities for pathogen spillover",,,,"(changes in) community composition, (changes in) geographic overlap, (changes in) interspecies contact",,,,,"encroachment, land conversion for agriculture",
6/6/2018 13:39,Hypothesis,13,"Loss of biodiversity can exacerbate the risk of pathogen spillover. In low diversity communities, vectors attain higher pathogen prevalences because they feed more frequently on primary reservoirs. Conversely, vectors in high biodiversity communities feed on a wider range of hosts, some of which are poor pathogen reservoirs, often resulting in lower pathogen prevalence at ecological community level",,,,(changes in) biodiversity,,,,vector transmission,,
6/6/2018 13:44,Hypothesis,13,"Expansion of agriculture promotes encroachment into wildlife habitats, leading to ecosystem changes and bringing humans and livestock into closer proximity to wildlife and vectors, and the sylvatic cycles of potential zoonotic pathogens. This greater intensity of interaction creates opportunities for spillover of previously unknown pathogens into livestock or humans and establishment of new transmission cycles.",(changes in) agriculture,,,"(changes in) community composition, (changes in) geographic overlap, (changes in) interspecies contact",,,,,encroachment,
6/6/2018 13:47,Hypothesis,13,Water management activities may result in increased density of breeding sites for mosquitoes,(changes in) water management,,,,,,,vector transmission,,
6/6/2018 13:51,Hypothesis,13,"the effect of fertilizer use on disease dynamics varies depending on the pathogen, the host, the ecosystem, and the level of environmental nutrient enrichment (ENE), but parasites with complex life cycles, especially trematodes, increase in abundance under nutrient-rich conditions because their intermediate hosts - snails, worms, crustaceans - have increased population density and survival of infection.",,,,,,,,intermediate transmission,ecosystem enrichment,
6/6/2018 13:52,Hypothesis,13,"Intensification of livestock production, especially pigs and poultry, facilitates disease transmission by increasing population size and density",(changes in) agriculture,,,,,,"bird, swine, (changes in) abundance and distribution",,,
6/6/2018 14:16,Hypothesis,13,"Intensification also requires greater frequency of movement of people and vehicles on and off farms, which further increases the risk of pathogen transmission",(changes in) agriculture,,,,(changes in) global transportation,,,,,
6/6/2018 14:24,Hypothesis,13,"Intensive livestock farming can promote disease transmission through environmental pathways. Ventilation systems expel material...into the environment, increasing risk of transmission to wild and domestic animals. Large quantities of waste are produced that contain a variety of pathogens capable of survival for several months if left untreated. Much of the waste is spread on land, where it can come into contact with wild animals and contaminate water. Similarly, use of animal waste in aquaculture leads to potential contact with wild birds","(changes in) agriculture, attraction of wildlife and commensals, (changes in) water management",,,,,(changes in) sanitation and public health infrastructure,,,,
6/6/2018 14:27,Hypothesis,13,"Intensive livestock systems generally have high density populations of low genetic diversity, which may favor increased transmission and adaptation. Epidemiological modeling experiments indicate that lower genetic diversity was associated with an increased probability of a major epidemic or no epidemic at all, whereas a more diverse population had a higher probability of a minor epidemic","(changes in) agriculture, (changes in) livestock densities and distribution",,,,,,reservoir competence,,,
6/6/2018 14:28,Hypothesis,13,"Food-borne bacterial pathogens evolve in response to environmental changes, developing new virulence properties and occupying new niches, including antimicrobial resistance. Such evolution can be facilitated by intensified livestock systems",(changes in) agriculture,,,,,,,"bacteria, adaptation and evolution, drug resistance",,
6/18/2018 13:15,Hypothesis,14,Exponential growth in the human population has increased the food demand all over the world. Large areas are being converted to agricultural land.,(changes in) agriculture and farming practices,,(changes in) human density and distribution,,,,,,land conversion for agriculture,
6/18/2018 13:16,Hypothesis,14,"Culture, tradition, religion and geographical location govern the range of food we are exposed to, how they are cooked, the ingredients added, etc. and therefore will also govern the parasites that we are exposed to...Animals that some cultures consider companion, work, wild or domestic are viewed by others as important sources of protein; guinea-pigs, horses (Trichinella spiralis), dogs (Leptospirosis, Cryptosporidiosis) and a range of wildlife species are consumed by many people. Tourism, immigration and exposure via the media have increased popularity of different kinds of food and have broadened people’s eating habits.",,,"(changes in) food preferences, preparation, and storage",,tourism and travel,,,,,
6/18/2018 13:17,Hypothesis,14,The rapid transport and cold storage facilities enable the survival of parasites in food as well as surface contaminants,(changes in) food availability and distribution,,,,,,,,,
6/18/2018 13:19,Hypothesis,14,Bushmeat (primate meat and brain) is a multibillion dollar business with huge urban demand. The demand is recently being easily met due to facilitated access to primate habitats by logging roads in Africa,,,(changes in) hunting behaviour,,,,non-human primate,,encroachment,
6/18/2018 13:20,Hypothesis,14,deforestation and agricultural development leading to human habitat expansion into natural foci of a viral infection,,,(changes in) human density and distribution,(changes in) geographic overlap,,,,virus,"deforestation, land conversion for agriculture",
6/18/2018 13:21,Hypothesis,14,Exotic pets have been a source of infection from endemic regions to very rare or new regions,,,captive wildlife,,,,,,,
6/18/2018 13:22,Hypothesis,14,Mixed farming or transfer of farm waste to other farms can facilitate the emergence of a new variant of a virus,(changes in) agriculture and farming practices,,,,,,,"virus, adaptation and evolution",,
6/18/2018 13:29,Hypothesis,14,"The construction of new roads provides access for human, livestock, vector and parasite populations...By providing access to forested and newly deforested areas, non-immune, non-protected populations, such as construction workers, loggers, miners, tourists and conservationists are exposed to indigenous and newly arrived vectors and their parasites",,,(changes in) susceptibility,"(changes in) community composition, (changes in) geographic overlap",,,,,encroachment,
6/18/2018 13:31,Hypothesis,14,"Establishment of animal conservation and rehabilitation centres, national parks and wildlife reserves, which is facilitated by new access roads, increases the association between humans and animals, as do zoos, aquaria and seaworlds, industrial animal production, nontraditional agriculture, aquaculture, free-ranging/farmed game species and hunting",(changes in) agriculture and farming practices,,"captive wildlife, (changes in) hunting behaviour",(changes in) interspecies contact,,,,,,
6/18/2018 13:32,Hypothesis,14,"Adventure travel is the largest growing segment of the leisure travel industry; growth rate has been 10% per year since 1985. This type of travel increases the risk of tourists participating in activities such as safaris, tours, adventure sports and extreme travel contact pathogens uncommon in industrialized countries",,,,(changes in) interspecies contact,tourism and travel,,,,,
6/18/2018 13:34,Hypothesis,14,Transportation vehicles can serve as mechanical vectors for the dispersion of pathogen or vectors,,,,,(changes in) global transportation,,,vector transmission,,
6/18/2018 13:35,Hypothesis,14,"concentrated resources influence host migration into urban landscapes and therefore increase species contact rates, including contact between humans and wildlife hosts",attraction of wildlife and commensals,,,(changes in) interspecies contact,,,(changes in) foraging behaviour,,urbanization,
6/6/2018 14:39,Hypothesis,15,"The paleoparasitological findings since then have always shown the presence of zoonotic parasites transmitted mainly by consumption of and/or contact with domesticated animals. The domestication of animals and plants favored an increase in the occurrence of parasitosis among human populations, as exemplified in specific regions...With domestication, humans kept animals close to them for consumption, like cattle, goats, and pigs, as well as companion animals like dogs and cats...This constant contact with animals facilitated the transmission of parasites, including zoonotic ones",(changes in) agriculture,,,,,,,close contact,,
6/6/2018 14:41,Hypothesis,15,"agricultural surplus was stored in deposits, increasing the potential risk of infection by contamination of the grain or other foodstuffs and by attracting animals like rodents, the natural hosts of various zoonoses affecting humans",attraction of wildlife and commensals,,"(changes in) food preferences, preparation, and storage",,,,,,,
6/6/2018 14:43,Hypothesis,15,"climate changes affected the production of cultivated grains, leading to subsistence crises. The population was thus forced to turn to the consumption of wild vegetables, and also hunting and fishing, often consuming raw items",,extreme climate events,"(changes in) food preferences, preparation, and storage",,,famine,,,,
6/6/2018 15:54,Hypothesis,16,"contact rates between zoonotic hosts, humans, and vectors can respond to changes in landscape or climate...Changes in contact rates that accompany environmental changes can occur both within and between populations...changes in landscape and climate can affect contact rates between developmental stages of pathogen life cycles and hosts (zoonotic or humans); for instance, environmental stressors can change longevity or movement patterns of environmental stages of vectors or hosts and thereby affect contact rates",,global warming,,(changes in) interspecies contact,,,(changes in) abundance and distribution,,,
6/6/2018 15:56,Hypothesis,16,"Anthropogenic changes to landscapes, from fragmentation of previously continuous habitats to creation of reserves, can concentrate animal populations in small areas at unnaturally high densities. Because host density is a key driver of transmission rates, these changes may create new foci of transmission or novel sources of zoonotic infections because reserves may also attract human visitors.",,,,,,,(changes in) abundance and distribution,,"fragmentation, reforestation and restoration",
6/6/2018 15:57,Hypothesis,16,"Similarly, changes in food or other key resources, without changes to the habitat itself, can promote clumping of hosts and create foci of intra- or interspecific parasite transmission",,,,foraging behaviour,,,(changes in) abundance and distribution,,,
6/6/2018 15:58,Hypothesis,16,"Pathogens are more likely to colonise new host species that present conditions similar to those associated with their current hosts; therefore, they spread more readily among closely related hosts",,,,,,,phylogenetic relatedness,host switching and breadth (generalism/specialism),,
6/6/2018 16:00,Hypothesis,16,"changing risk of transmission of zoonoses when human behaviour causes habitat change, such as forest clearing, which may also increase probability of exposure to vectors or hosts",,,,(changes in) interspecies contact,,,,,deforestation,
6/5/2018 10:32,Hypothesis,17,"Individual human practices that predispose to zoonotic infections have been increasingly recognized in recent years as means of exposure to zoonotic agents. Such factors are often consequences of globalization and the ease of international travel. A typical example would be the expanding industry of ecotourism: urban citizens of the developed world who visit developing countries or rural areas of the developed world and engage in activities such as forest camping, river rafting, or bat cave exploring, are prone to zoonotic infections",,,,,tourism and travel,,,,,
6/5/2018 10:35,Hypothesis,17,"Hunters are increasingly recognized as an important target group for zoonotic infections, through direct exposure to agents existing in the soil of forests/hunting areas in general, or through direct contact with and consumption of infected wildlife meat products",,,(changes in) hunting behaviour,,,,,"close contact, non-close contact",,
6/5/2018 10:38,Hypothesis,17,"Exposure to the culinary customs of developing countries (or rural regions of the developed world) often results in exposure to typical and non-typical (such as Brucella) foodborne pathogens. Culinary practices that have emerged as fashionable in recent years, e.g. raw fish or even bushmeat consumption, have led to exposure of unsuspecting connoisseurs to unusual infectious bacteria and parasites",,,"(changes in) food preferences, preparation, and storage",,,,,,,
6/5/2018 10:38,Hypothesis,17,"The increased trend for pet ownership results in increased exposure to zoonotic pathogens, particularly with regard to non-traditional pets such as lizards and primates",,,captive wildlife,,,,non-human primate,,,
6/5/2018 10:44,Hypothesis,17,"The population of the world has been constantly increasing, resulting in increased demands for food, including meat; the industrialization of animal raising for food purposes and the intensive husbandry systems applied have resulted in the development of vast animal reservoirs in which an infection can spread from one animal to another and then jump species...this is also the rule for the extensive, sanitarily challenged animal markets of the East. The need for increased livestock production also leads to the expansion of farming in previously non-inhabited areas, through deforestation for farm development or common breeding areas for livestock and wildlife species carrying a disease","(changes in) agriculture, (changes in) livestock densities and distribution",,(changes in) human density and distribution,,,,,,"deforestation, encroachment, land conversion for agriculture",
6/5/2018 10:50,Hypothesis,17,"industrialization, the development of megacities and generalized urbanization...have led to a continuous encroachment of humans into previously uninhabited areas: this not only affects the ecology of wildlife habitats, unleashing dynamics that allow for zoonotic pathogen or vector predominance...but also directly brings essentially ‘virgin’ human populations into contact with a novel environment (including its zoonotic agents)",,,,"(changes in) geographic overlap, (changes in) interspecies contact",,,,,"encroachment, urbanization",
6/5/2018 10:53,Hypothesis,17,"Politics also exert a direct effect on the prevalence of zoonotic infections. The typical example here is the transition of numerous countries in recent years from communist, strictly state-controlled economies to free trade. This has led to the resurgence of numerous zoonotic agents, owing to less strict veterinarian and public health surveillance, but also to the recognition of hitherto undetermined/underevaluated zoonotic foci...when political transition was associated with conflict...the social substrate for zoonotic outbreaks became stronger, aided by factors such as famine, involuntary immigration of large human populations, and total breakdown and delayed redevelopment of public health and medical infrastructures",,,,,,"famine, (changes in) governance & politics, human displacement, (changes in) public health measures, war & conflict",,,,
6/5/2018 11:00,Hypothesis,17,"The only pathogen-related factor that can be considered to be intrinsic is genomic variability, and this is particularly relevant to viral zoonotic agents, and specifically RNA viruses: their enormous mutation rate is essentially a factory producing the species that are most potently pathogenic for humans",,,,,,,,"virus, adaptation and evolution",,
6/5/2018 11:02,Hypothesis,17,"In the case of non-viral pathogens, environmental or human pressure can be exerted for selection of strains that are more virulent or resistant to available treatments (a characteristic that is also known for species jumping and is thus favoured by pathogen biodiversity), through the wide, often uncontrolled, use of antibiotics in veterinary medicine, and the non-selective, non-rotational use of pesticides (in the case of zoonotic vectors)",,,,,,,,"bacteria, adaptation and evolution, drug resistance",,
6/5/2018 11:05,Hypothesis,17,"Human intrusion in any ecosystem is disruptive, and the resulting disequilibrium may create a conservatory for zoonotic agents: deforestation is the most typical procedure implicated, drastically altering the geological, hydrological and biological characteristics of a given space, often replacing it with plantations with different ecological correlations, grazing fields, or rice plantations, or even new-built suburban housing. In each case, changes in the synthesis of the local fauna may result in significant increases in the population of a definite zoonotic agent host, which in turn may increasingly come into contact with humans",(changes in) agriculture,,,"(changes in) community composition, (changes in) interspecies contact",,,(changes in) abundance and distribution,,"deforestation, encroachment, land conversion for agriculture",
6/5/2018 11:14,Hypothesis,17,"Global warming is an ecological emergency, but its implications for human disease caused by infectious agents remains understudied: It is well known that the mosquito life cycle is affected by temperature, meaning that a slight (1–2C) increase in average summer temperature may allow mosquitoes to inhabit temperate zones, often carrying with them zoonotic agents for which they serve as vectors. Bird migration may be affected by global temperature alterations: birds seeking novel migratory routes may also transfer a novel zoonosis to a previously non-endemic area...zoonotic infections exhibit a tendency to move their ecological landscape westwards...and polewards, because of the gradual narrowing of the traditional temperate zones",,"global warming, (changes in) temperature",,(changes in) geographic overlap,,,"bird, (changes in) abundance and distribution",vector transmission,,
6/6/2018 10:23,Hypothesis,17,"biodiversity may act inversely on the long-term prevalence of zoonoses, by creating a niche that favours reassortment and species jumping",,,,(changes in) biodiversity,,,,,,
6/6/2018 10:28,Hypothesis,17,"human ‘developmental’ intrusions need not be grand in scale to interrupt the balance of a specific ecosystem. Even simple road construction can have such an effect, through alteration of the hydrological characteristics and the ensuing creation of stagnant ponds that may act as zoonotic conservatories",,,,,(changes in) global transportation,,,,urbanization,
6/5/2018 11:23,Hypothesis,18,"Transmission in the Farm, Fair, or Petting Zoo...Animal fur, hair, skin, and saliva can harbor infectious organisms due to fecal contamination. Transmission occurs when people pet, touch, feed, or are licked by animals, or when they have contacted contaminated animal bedding, flooring, barriers, or other contaminated surfaces, including strollers, clothes, and shoes",(changes in) agriculture,,,(changes in) interspecies contact,(changes in) animal trade and transport,(changes in) sanitation and public health infrastructure,,"close contact, non-close contact",,
6/5/2018 11:26,Hypothesis,18,"Management factors can also increase the risk of pathogen transmission at animal exhibits. For example, animals are more likely to shed pathogens due to stress from prolonged transportation, confinement, crowding, and increased handling by humans","(changes in) livestock densities and distribution, (changes in) agriculture",,,,(changes in) animal trade and transport,,,,,
6/7/2018 12:09,Hypothesis,19,"Risk factors for emergence, in addition to being a market worker as suggested by the completed study, might also include being a hunter of wild animals, being a restaurant worker who kills and or butchers/prepares wild animal meat for consumption, or being a member of a household who buys live or recently killed wild game meat from a wet market",,,"(changes in) food preferences, preparation, and storage, (changes in) hunting behaviour",,,,,,,
6/7/2018 12:11,Hypothesis,19,"Emergence may occur among humans living and working in small rural farming communities carved out of tropical rain forests, savannah, mountains, and desert that are in close proximity to wild animals, or to domestic animals they tend that have been in close proximity to wild animals...Emergence may occur in larger urban communities where human contact with animals is limited to a few farm animals in close proximity to households, to domestic pets, or to rodents and other animals that have adapted to the urban environment...Risk factors of emergence in these settings are lacking or inadequate community planning, lack of understanding by populations about risks associated with animal contact, failure to adopt and adhere to safe farming and slaughter/food processing and preparation practices, and failure to maintain sanitation and water infrastructure",,,"(changes in) food preferences, preparation, and storage",(changes in) interspecies contact,,(changes in) sanitation and public health infrastructure,,,encroachment,
6/7/2018 12:16,Hypothesis,20,Communities planting crops settled and grew in relatively fixed locations. This likely increased their exposure to their own waste as well as to reservoirs of disease such as unintentional rodent domesticants that may have set up permanent habitats proximate to human dwellings,"(changes in) agriculture, attraction of wildlife and commensals",,,,,,,,,
6/7/2018 12:18,Hypothesis,20,"the domestication of animals around 10,000 years ago likely provided the greatest conduit for zoonotic disease transmission",(changes in) agriculture,,,,,,,,,
6/7/2018 12:18,Hypothesis,20,Encroachment into natural habitats may bring humans into new contact with pathogens,,,,,,,,,encroachment,
6/7/2018 12:19,Hypothesis,20,The broad range of tissue and fluid exposures associated with the bushmeat industry’s hunting and butchering may make these wildlife interactions especially risky,,,(changes in) hunting behaviour,,,,,,,
6/7/2018 12:20,Hypothesis,20,"Holding different populations of captive primates together during transport or while housed at or en route to zoos or laboratories might result in viral recombination, potentially resulting in unpredictable, new strains that could otherwise never have occurred",,,,,(changes in) animal trade and transport,,non-human primate,"virus, adaptation and evolution",,
6/7/2018 12:24,Hypothesis,20,"The immunosuppressive stress of prolonged live animal transport may not only increase a healthy animal’s susceptibility to infection, but may trigger the emergence of a variety of diarrheal and respiratory diseases caused by endogenous microoganisms that might not normally lead to disease. Long-distance transport may also increase the fecal shedding of zoonotic disease agents.",(changes in) agriculture,,,,,,,,,
